{
  "id": "11-capstone",
  "level": 9,
  "title": "Capstone: Build My Personal AI-SDLC Engineering System",
  "summary": "Assemble everything from modules 00 to 10 into one system you can run and trust: see how every folder in AI-SDLC/ fits together and which parts are verified Claude Code formats, prove the wiring with a single zero-dependency check that also finds a real seam between an agent's Bash guard and its preloaded skill, trace one feature (PAT-142 paging) and one production incident ($lastn latency with probe restarts) through the orchestrator, every agent and every human gate, and finish by moving the system to your own stack and domain with a measured checklist.",
  "prerequisites": [
    "08-workflow-orchestration",
    "09-agent-evaluation",
    "10-governance",
    "05-agent-roster",
    "04-skills-security-performance-rca",
    "Node 22, Java 21, Maven 3.9, an authenticated Claude Code CLI"
  ],
  "concepts": [
    {
      "heading": "One system, seven layers",
      "body_md": "Each earlier module built one layer. The capstone is about the seams between them, because that is where a working set of parts stops being a working system.\n\n| Layer | Files | Question it answers |\n|---|---|---|\n| Knowledge | `CLAUDE.md`, `.claude/rules/`, `context/**` | What does every agent know without asking? |\n| Capability | `.claude/skills/**`, `.mcp.json`, `mcp/` | What procedures and tools exist? |\n| Actors | `.claude/agents/*.md`, `agents/*/CONTRACT.md` | Who may do what, with which model and tools? |\n| Sequencing | `orchestrator.md`, entry-point skills, `workflows/*.md` | In which order, with which conditions and retries? |\n| Enforcement | `.claude/settings.json`, `.claude/hooks/`, `agents/tool-guard.mjs`, `workflows/gates.settings.json` | What is blocked, asked, or checked on every call? |\n| Measurement | `evaluations/`, `skills/*/tests/` | Did a change make an agent or skill better or worse? |\n| Governance | `docs/governance/`, `scripts/governance/`, `company-ai/` | Who approves changes to all of the above? |\n\nThe layers reference each other by **name and path**, and nothing in Claude Code checks those references for you. An agent's `skills:` entry that names a missing skill, a hook command that points at a moved script, or a workflow step that names an agent the orchestrator cannot spawn all fail silently or at the worst moment: unknown frontmatter fields are ignored, and a hook script that does not exist is a non-blocking error, not a blocked call. So in practice the system needs a check of its own seams, run in CI and before every workflow run. That is `scripts/capstone/verify-system.mjs` (exercise `11-verify-system`)."
    },
    {
      "heading": "The orchestrator and its human gates, reconciled",
      "body_md": "Module 08 built the orchestrator and its contract (see `08-workflow-orchestration` and `agents/orchestrator/CONTRACT.md`; this module adds no new contract). It runs as the **main thread**: `claude --agent orchestrator --settings workflows/gates.settings.json`. Two facts from the docs carry the design: the `Agent(architect, developer, reviewer, tester, security, sre)` list in its `tools` is enforced only because it is the main-thread agent, and the roster agents omit `Agent` so the tree stays one level deep.\n\nModule 08 numbers workflow gates G1 to G3 (plus G-M for incidents); module 10 numbers governance layers G1 to G8. They are the same controls from two sides:\n\n- **G1 plan approval** = the `ask` rule on `Agent(developer)` in `workflows/gates.settings.json`. Every developer launch, including each rework, is a permission prompt.\n- **G2 findings** = the orchestrator stopping with `status: needs-human`. This one is a **prompt instruction, not a built-in feature**. Its mechanical backstop is the next `Agent(developer)` prompt and the PR review.\n- **G-M mitigation** = nobody but a human changes production: the orchestrator has no Bash, the sre's `tool-guard.mjs` always denies mutating `kubectl`, `kubectl apply` is `ask`, `kubectl delete` is `deny`.\n- **G3 merge** = PR review under branch protection and CODEOWNERS (module 10 G6/G7); `git push` is `ask`, `gh pr merge` is `deny`.\n\nRun gated workflows in `default` permission mode. In `dontAsk` every `ask` becomes a denial, so a headless run stops at G1 by design; `bypassPermissions` skips prompts, so G1 disappears; in `auto` this course has not verified how `ask` rules behave, so do not rely on G1 there (see the (verify) cells in `docs/governance/approval-gates.md`). Knowing which gate is a mechanism and which is a convention is the most important thing to be able to say about your own system."
    },
    {
      "heading": "Tracing a feature: PAT-142 through every layer",
      "body_md": "The committed run `workflows/examples/feature-patient-pagination/` (module 08) shows the handoffs. The capstone view (`docs/capstone/walkthrough-feature.md`) adds what acts at each moment:\n\n1. **Before**: clean tree, `verify-system.mjs` WIRED, eval replay green for the two evaluated agents this run uses (architect at step 02, reviewer at step 08).\n2. **`/feature PAT-142 ...`**: the skill is `disable-model-invocation: true` (only you start it), registers the `SubagentStop` handoff hook, injects `git status --short`.\n3. **01 to 03**: orchestrator skills and the architect write the requirements, ADR-0002 draft and plan. `block-secrets.mjs` scans each Write; the hook validates each specialist's handoff.\n4. **G1**: a permission prompt for `Agent` with `subagent_type: developer`. You read 01 to 03 first.\n5. **04 to 06**: the developer is scoped by `tool-guard.mjs` to `sample-app/src/` and `.ai-sdlc/runs/`; tester and security run in the same turn; TST-1 (high) blocks.\n6. **G2**: you decide \"fix TST-1 and SEC-1\"; the rework is another G1 prompt.\n7. **08 to 09**: reviewer returns findings inline (no Write), run report ends `next: human`.\n8. **G3**: you push and open the PR. Only `sample-app/` changed, so the AI-config gate passes and normal code-owner review applies.\n\nEvals and governance apply differently: governance (hooks, rules) acts on **every tool call of every run**; evaluation acts on **changes to the system** (a new reviewer prompt must pass replay and a live comparison before its PR merges)."
    },
    {
      "heading": "Tracing an incident: no agent changes production",
      "body_md": "The incident run (`docs/capstone/example-runs/incident-lastn-latency/`) replays INC-2026-0922-01 from the production-rca evidence pack. Clinic C-017's new ward dashboard sent `$lastn` for 512 subjects every 30 s; `ObservationService.lastN` (`TEACHING-DEFECT(perf-n+1)`, lines 69 to 74) runs two statements per subject and loads full histories, so one request was about 1,024 statements and 209,000 rows; pods saturated, the 1 s probes failed, Kubernetes restarted the pods into the same load.\n\nWhat the system does, step by step:\n\n- **01 brief**: the orchestrator strips the one patient named in the on-call report and decides that **security runs**: the logs show `GlobalExceptionHandler` ERROR lines, and D-04 in `KNOWN_DEFECTS.md` says that handler can log submitted values. Possible data exposure is the spec's condition.\n- **02 sre + 03 security in parallel**: sre runs the `build-timeline.mjs` PHI guard (exit 0), ranks five hypotheses, offers M1 (dashboard off), M2 (ingress limit), M3 (scale out, low confidence). Security finds no PHI in the pool-timeout exceptions and flags the shared `clinician` account.\n- **G-M round 1**: the human scales to 4 from their own terminal. **04** verifies: not resolved.\n- **G-M round 2** (the last one the spec allows): the dashboard refresh is disabled. **05** verifies recovery and confirms H1 with `pg_stat_statements` (431,616 calls = 843 requests x 512 subjects).\n- **06** hands the code fix to `/bug-fix FHIR-311`, a separate run with its own G1 to G3. **07** postmortem is `needs-human` until signed off.\n\nThe retry shows the numbering rule from `workflows/README.md`: a repeated step takes the next free number, so the spec's 05/06 became 06/07."
    },
    {
      "heading": "Verifying the wiring: checks at the seams",
      "body_md": "Every module shipped a checker for its own layer: `check-agents.mjs` (contracts), `check-roster-flat.mjs` (topology), `check-mcp-config.mjs`, `check-agent-policy.mjs`, `validate-skill-library.mjs`, `check-handoff.mjs`, the eval harness. `verify-system.mjs` runs all of them and adds the cross-layer checks none of them owns:\n\n- every `skills:` entry of every agent resolves to a `.claude/skills/<name>/SKILL.md` that can be preloaded (not `disable-model-invocation: true`);\n- every hook script path in `settings.json` **and** in agent and skill frontmatter exists; every hook event is a documented event;\n- `workflows/gates.settings.json` really asks before `Agent(developer)`, and every `Agent(...)` rule names a real agent;\n- workflow step tables name only roster agents and existing skills;\n- CLAUDE.md `@imports` resolve (outside code spans, up to 4 hops);\n- **guard reach**: each script a preloaded skill tells an agent to run is inside that agent's `tool-guard.mjs bash-allow` list.\n\nThe last check found a real defect while this module was written. `production-rca` step 1 tells the sre to run `build-timeline.mjs` (the PHI guard), but the sre's Bash guard in `.claude/agents/sre.md` allows only `count-queries.mjs` among the node scripts. Each part passes its own checker; together the sre cannot start an RCA without being blocked with exit 2. A second, softer seam is reported as WARN: skills that invoke scripts as `${CLAUDE_SKILL_DIR}/scripts/...` while the guard matches a relative prefix literally.\n\nSo in practice: run `verify-system.mjs` in CI next to `mvn -q -B test`, and treat a FAIL row as a broken build."
    },
    {
      "heading": "Personalizing: what carries over and what does not",